{"final_document_binding":{"database_instance_fingerprint":"3549b0028b75d981cdda2e573e9cb49dedc200185876df299f912b79f69dabd8","output_copy_binding":{"byte_size":129,"dwg_header_signature":"AC1032","file_identity_fingerprint":"5f84f12b50ba4741a54325334fb204e6af77f7c30cf341c76cea2b33bb2fc222","format":"DWG","path_fingerprint":"a0af9f865bf637e6736817f4ce552e4cdf7b8c36ea75bc254c1d1f0af744b5bf","sha256":"37adae9a85f743437b2c311f5b276dc2ad88937600d43a7d34b8227efdc0db26"},"revision_fingerprint":"2b214ddf3326016519afcb268f63623b80b91a65265277668e4d020d87dd9078"},"final_revision_fingerprint":"2b214ddf3326016519afcb268f63623b80b91a65265277668e4d020d87dd9078","final_revision_transition":"save_reopen_changed","integrity":{"algorithm":"SHA-256","sha256":"4ff97b27fef1264886431383a2aa80e908db93bccdb8ec58ea3fe6e326bdd29b"},"manifest_id":"native-manifest-cccccccccccccccccccccccccccccccc","manifest_integrity_sha256":"bf6c7e14cb1b8a0f6b2bcf8dac5c756eb03a4033b73f40a3a1d4e1b658605564","nonce":"zzzzzzzzzzzzzzzzzzzzzzzzzzzzzzzzzzzzzzzzzzz","operation_results":[{"operation_id":"native-operation-aaaaaaaaaaaaaaaaaaaaaaaa","postcondition_digest":"1ae4d149a43347f104f72a3b62c9614aeced02379dbce0981d6041ae3f452271","status":"applied"}],"run_id":"native-run-dddddddddddddddddddddddddddddddd","schema_version":"liang-pingfa/native-console-result/v1","transaction":{"outcome":"committed","preflight":"passed","rollback":"not_required"}}
